"This guy's walking home from work, really late, in the pitch black of night.There isn't another soul on the street. Suddenly, from out of the gloom,comes an ominous bump...bump...bump. He looks behind him and spots afurtive, shadowy thing coming down the street after him. Unnerved, he picksup his pace, finally breaking into a panicked run. He looks behind himagain, and the shadow is closer. Bump...bump...bump. The glow of astreetlight illuminates the shadow momentarily, and, to the man's horror, itis a coffin, bumping down the sidewalk. He quickens his pace, running asfast as he can go, but the coffin only pursues more quickly.BUMP...BUMP...BUMP! He reaches his house, fumbles frantically for hiskeys, and slips in the door just as the coffin reaches his front steps. Heslams the door and leans against it, catching his breath.Bump...bump...bump. There is a moment's silence, and the man wondersif he dares to breathe. Suddenly.... Bump...bump...bump...Bump...BUMP!BUMP! BUMPBUMPBUMPCRAAAAASH!!!! He rebounds away as the door breaks offits hinges. Scrambling to his feet, he charges up the stairs, and the coffinraces after. BUMP BUMP BUMP BUMP! Terrified, he backs into a cornerand starts throwing everything within reach at the coffin -- a handful ofpapers, a vase, a box of crackers, a lamp -- but the coffin keeps coming!BUMP BUMP BUMP BUMP BUMP INCHESFROMHISFACE, and nothing seems to slow it down!His hands fall upon a bottle of cough syrup, and he throws that at the coffin,too!The coffin stops."
"This one Roman governor was a spontaneous guy, and he was often annoyed when his astrologer buddy had to consult the stars before they could meet for a beer or go to the gladiator fights. Soon he got so fed up that he stopped calling him. The astrologer called him a month later, claiming that he had turned over a new leaf. Incredulous, the governor asked, ""OK, how about a game of racquetball then?"" There was a long pause. ""What are you doing now?"" he asked sharply.""Hang on, I'm checking my palm, Pilate."""
"Three construction workers (an Italian, a Mexican, and a Redneck) were sitting on a steel beam at the top of a skyscraper they were building. It was lunchtime. The Italian worker opens his lunch box and sees that he has spaghetti and meatballs.

""Son of a bitch"", he says, ""spaghetti and meatballs again. Everyday it's spaghetti and meatballs. I swear if I get spaghetti and meatballs again tomorrow I'm going to commit suicide by jumping off this building"".

The Mexican worker opens up his lunch box and sees a burrito. ""Damnit"", he says, ""another damn burrito, I'm so tired of burritos, If I have to eat a burrito again tomorrow I'm going to jump off of this building and commit suicide"".

The Redneck worker opens his lunch box and sees a bologna sandwich. ""Shit!!!, another damn bologna sandwich. If I get another bologna sandwich tomorrow, I'm going to commit suicide"".

The next day during lunch hour, they are sitting on the same steel beam. The Italian worker opens his lunch box and finds spaghetti and meatballs. Without saying a word he closes the box and throws himself off of the beam and drops twenty floors to his death. The Mexican worker opens his box, finds a burrito, closes the box and jumps to his death. The Redneck worker opens his box and finds a bologna sandwich, closes the box and jumps to his death.

A couple of days later the families of all three workers meet at the cemetery just after the funerals. The Italian worker's wife was crying.

""Oh, if only I had known how he felt about the spaghetti and meatballs, I could have fixed him a muffalotta, and he would still be here today.

The Mexican worker's wife said ""I could have fixed my husband a taco or an enchilada, and he would be here with me today"".

There was a moment of silence while everybody was waiting for the Redneck worker's wife to comment.

""Don't look at me"", she said, ""He fixes his own lunch""."
Three elephants fell off a cliff. Two fell on land. One fell in the water.Boom-boom-chhh!
"Three guys are walking down the street, two of them walk into a bar.... the third one ducks"
"Three men were fishing in the Gulf of Mexico when one of them pulled in ahuge fish. But as soon as it was in the boat, the fish shook thehook out of its mouth and changed into an angry, bearded man wearing a crownand brandishing a three-pronged spear.""Who are you, sir?"" quavered one of the fishermen.""I am Neptune, god of the sea, and I am going to put a curse on you!Before you get home, your boat will spring a dozen leaks -- nay, make thata dozen and a half, for good measure!""With a nasty laugh, Neptune dived over the side and disappeared. Thefishermen's boat got so many holes they had to swim ashore, and fromthat day to this, they have never forgotten Neptune's eighteen holegulf curse."
"Three statisticians went duck hunting. A duck flew out and the first statistician took a shot, the shot went a foot too hight. The second statistician took his shot and the shot went a foot too low. The third statistician said, ""We got it!"""
"Tired of being broke and stuck in an unhappy marriage, ayoung husband decided to solve both problems by taking out a largeinsurance policy on his wife and arranging to have her killed.A ""friend of a friend"" put him in touch with a nefarious underworldfigure, who went by the name of ""Artie."" Artie explained to the husbandthat his going price for snuffing out a spouse was $5,000. The husbandsaid he was willing to pay that amount, but that he wouldn't have anycash on hand until he could collect his wife's insurance money.Artie insisted on being paid in part up front. The man opened up hiswallet and displayed the single dollar bill that rested inside. Artiesighed, rolled his eyes, and reluctantly agreed to accept the dollar asdown payment for the dirty deed.A few days later, Artie followed the man's wife to the local Safewaygrocery store. There, he surprised her in the produce department andproceeded to strangle her with his gloved hands. As the poorunsuspecting woman drew her last breath and slumped to the floor, themanager of the produce department stumbled unexpectedly onto the scene.Unwilling to leave any witnesses behind, Artie had no choice but tostrangle the produce manager as well.Unknown to Artie, the entire proceeding were captured by hidden camerasand observed by the store's security guard, who immediately called thepolice. Artie was caught and arrested before he could leave the store.Under intense questioning at the police station, Artie revealed thesordid plan, including his financial arrangements with the haplesshusband.And that is why, the next day in the newspaper, the headline declared: ""Artie chokes two for a dollar at Safeway."""
To err is human; to moo bovine.
"tried to drown my sorrows, but after three days, mother-in-law floated back to the shore."
"Two atoms are talking: ""Help, somebody has stolen one of my electrons!"" ""Are you sure?"" ""Yes, I'm positive!"""
"Two boll weevils grew up in South Carolina. One went to Hollywood andbecame a famous actor. The other stayed behind in the fields and never amounted to much. The second, naturally, became known as the lesser of two weevils."
"Two brothers are separated at birth, one going to live in the big city and the other on a farm in the coutry. Eventually, the two learn of each other and there's a happy reunion on the country brother's farm. Having never been to a farm before, the city brother asks for a tour. The farmer shows him the cows, the barn, horses, and the corn fields before coming to the pig sty, where he proudly introduces his prized possesion: a three-legged sow.

""That sow is finest animal to ever live,"" proclaimed the farmer, ""She saved my three children from the barn when it was burning down.""

""When I fell from the tree over yonder, she ran all the way to town and fetched the doctor,"" he continued.

""And, when my wife went into labor in the middle of the night, she delivered my yongest son!""

Amazed, the city brother remarked, ""that's quite a pig. But, what happened to her that she only has three legs?""

""Well, hell,"" said the farmer, ""be a damn shame, eat a pig like that all at once."""
"Two buddies, Tony and Steve, are getting very drunk at a bar when suddenly Steve throws up all over himself. ""Oh, no. Now Jane will kill me!"" Tony says, ""Don't worry, pal. Just tuck a twenty in your breast pocket, tell Jane that someone threw up on you and gave you twenty dollars for the dry cleaning bill."" So they stay for another couple of hours and get even drunker. Eventually Steve rolls into home and his Jane starts to give him a bad time. ""You reek of alcohol and you've puked all over yourself! My God, you're disgusting!"" Speaking very carefully so as not to slur, Steve says, ""Nowainaminit, I can e'splain everythin! Itsh snot wha jew think. I only had a cupla drrrinks. But thiss other guy got ssick on me... he had one too many and he juss couldin hold hizz liquor. He said he was verrry sorry an' gave me twennie bucks for the cleaning bill!"" Jane looks in the breast pocket and says, ""But this is forty bucks."" ""Oh, yeah...I almos' fergot, he shhhit in my pants, too."""
"Two cows are standing on top of a hill. One cow turns to the other cow and says: ""Are you worried about mad cow disease?""

The other cow looks puzzled: ""Why? I'm a helicopter."""
"two elephants and a drum kit fall of a cliff...

badum-dum-tish"
"Two Eskimos, sitting in a kayak, were very chilly. To keep warm, they lit afire in the craft, but it sank. They should have known. You can't have your kayak and heat it too."
"Two fish are in a tank. One says to the other, ""How do you drive this thing?"""
"Two friends are hiking in the mountains when they stumble across a grizzly bear. The bear rears up on its hind legs and roars at them, displaying all of the signs of aggression. They both know they're in real trouble.

One of the men sits down calmly, takes off his hiking boots, and pulls a pair of running shoes out of his backpack.

""What are you doing?"" screams his friend. ""You can't outrun a bear!""

""I don't have to"", he says while tying his shoes. ""I just have to outrun you."""
"Two functions, x^2 and e^x are walking down the street. Off in the distance they see a differential operator walking towards them. e^x turns to x^2 and tells him: ""You better get out of here! If that operator differentiates you a few times you'll disappear, but he can differentiate me all he wants and I'll stay the same.""

So x^2 runs off and e^x goes to greet the differential operator. ""Hi, I'm e^x"" he says. ""What's your name?""

The operator looks at him with a demonic grin and says: ""d/dy""."
"Two guys are walking down the street when they see a dog licking his balls. The first guy says, ""Man, I wish I could do that.

The second guy says, ""Pet him, maybe he'll let you."""
"Two guys walking on either side of a canal in Amsterdam, one named Claus, and one named Maus, and they yelled to each other ""Hey Claus!"" and ""Hey Maus!"" and when they finally met it was neither of them."
"Two hunters are out in the woods when one of them collapses. He doesn't seem to be breathing and his eyes are glazed. The other guy takes out his phone and calls the emergency services.

He gasps: ""My friend is dead! What can I do?"" The operator says: ""Calm down, I can help. First, let's make sure he's dead."" There is a silence, then a gunshot is heard. Back on the phone, the guy says: ""OK, now what?"""
"Two hunters out walking, split up, one finds gorgeous girl by the tracks, tells friend later about the amazing sex they had. ?Give me some details man, did you get a blow job?? ?Naw, I couldn?t find the head.?"
two irish men walk into a bar you thoght one of them would have seen it!
"Two lady ostriches out walking, get followed by male ostriches, try to get away, can?t, dart around a corner stick their heads in the sand."
"Two men are standing on a golf course. The first one steps up, tees his first ball, and positions himself for a swing. The man lifts his club, swings smoothly down and smacks the ball into the air. It sails off in a nice, long arc, but as it comes down the two men can see that it's heading straight for the water trap.

Just then, a wind picks up, and a lily pad is blown directly into the ball's path. The ball lands on the lily pad, and after a few seconds a frog hops up onto the pad, grabs the ball in its mouth, jumps off the pad and swims for shore.

When the frog reaches dry land, it spits out the ball, and no sooner has it disappeared into the water than a squirrel comes running up to the ball, grabs it in its paws, and scampers off across the grass. But before it can reach the trees, a hawk swoops down out of nowhere, grabs the squirrel in its talons, and begins to climb back up into the sky. Panicked and struggling to get free, the squirrel releases the ball from its paws, and with the altitude and speed gained from the hawk, the ball sails down in a long, clean fall straight into the hole. Hole in one.

The second man turns to the first, and says ""OK, God. Are you going to play golf or are you going to fuck around?"""
"Two men contracted to paint a small community church. Being very frugal(cheap), they pinched and scraped to spend the absolute minimum onmaterials. Then, when they were only partway through the job, theydetermined that they did not, after all, have enough paint to complete thejob. Not wishing to spend any more money if they didn't absolutely have to,they decided they would just dilute the water-based paint they were using sothat it would last longer. They did this a couple more times before theyfinished, which caused striping on the church as the paint got lighter eachtime it was thinned. The painters had just about gotten to the top of thesteeple, when, all of a sudden, the sky darkened, and the rain started topour down. As the paint streamed down the sides of the church, a voiceboomed from the heavens: ""Repaint, you thinners! Repaint, and thin no more!"""
"Two men were walking through the desert. They were nearly out of waterwhen they saw three tents in the distance. The hurried over to see if theycould get some water. In the first tent they were told, ""I'm sorry we onlyhave trifle."" In the second tent, again, ""I'm sorry we only have trifle.""They went into the third tent and again asked for water only to be told, ""I'msorry we only sell trifle."" As they walked on, one turned to the other andsaid, ""That was a trifle bazaar."""
Two monkeys stumbled into a wall. They were plastered!
"Two muffins are in an oven. One muffin says, ""Boy it sure is hot in here!"" the other muffin says, ""HOLY SHIT! A talking muffin!!"""
"Two muffins are in the oven. One looks over and says, ""Gee, don't you think it's hot in here?"" and the other muffin says, ""AAAAHHH!!!! A talking muffin!!!"""
"Two olives are pals, and they're hanging from the tree like they'vebeen for months. Suddenly, one falls to the ground. The remainingone says, ""Are you ok?"" And the other replies, ""Olive!"""
"Two pretzels were walking down the street, then one got a-salted"
Two Pretzels were walking down the street. One was assaulted.
"Two pumpkin pies are in the oven, and one pie says to the other pie, ?Are they really going to eat us?? and the other pie says, ?OH MY GOD A TALKING PIE!?"
"Two sausages are in a frying pan. One says, ""Geez, it's hot in here isn't it?""And the other one says, ""Aaaaaah! A talking sausage!"""
"Two ships were at sea, a British one and a German one. Suddenly the British ship malfunctioned and they were going down
So they radioed the Germans and said"" mayday mayday. We're sinking!!""

Some time lapsed and the Germans replied, ""what are you s-thinking about?"""
"Two strings walk into a bar. The first tries to order something. ""I don'tserve strings in this bar,"" the bartender says roughly and throws him out.The second ruffs himself up, ties his ends together, walks in, and orders.""Hey, didn't you hear what I told your buddy?"" the bartender says.""Yeah,"" the string says.""Aren't you a string?"" the bartender says.""I'm a frayed knot,"" the string replies."
"Two television sets got married. The wedding was boring, but the reception was beautiful."
"Two vultures boarded an airplane, each carrying two dead raccoons. Thestewardess looked at them and said, ""I'm sorry, gentlemen, only one carrionper passenger is allowed."""
"Veteran Pillsbury spokesmodel Pop-N-Fresh died yesterday of a severe yeas tinfection. He was 71. Fresh was buried in one of the largest ceremonies in recent years. Dozens ofcelebrities turned out, including Mrs. Butterworth, The California Raisins,Hungry Jack, and Betty Crocker. The gravesite was piled high with flours as longtime friend Aunt Jemima gave the eulogy, describing Fresh as a man who""never knew how much he was kneaded."" Fresh rose quickly in show business,but his later life was filled with many turnovers. He was not considered a very smart cookie, wasting much time on half-baked schemes. Still, even as acrusty old man, he was a roll model for millions. Fresh is survived by his second wife. They have two children and one in the oven. The funeral was held at 3:50 for about 20 minutes."
Wanna hear a dirty joke? Ok. The boy fell in the mud. Ready for a clean joke? Yeah. He took a bath.
"Watson arrives back at 221b Baker St., to find Sherlock Holmes bent over his desk, with his trousers round his ankles and a citrus fruit up his arse.

""My god man!"" bellows Watson, ""whatever's going on?""

""Ah,"" says Holmes, ""a lemon-entry, my dear Watson"""
"Watson: From what school did you graduate, Holmes? Holmes: Elementary, my dear Watson, Elementary..."
"Werner Heisenberg is driving down the street when a cop pulls him over. The cop walks up to the car, knocks on the window, and when Werner rolls it down, asks, ""Sir, do you know how fast you were going?""

""No,"" replies Werner. ""But I knew where I was!"""
What are swearing outdoor grills powered with? Profane tanks.
"What can you sit on, brush your teeth with, and eat soup with? A chair, a toothbrush, and a spoon."
What connects the computers in Sauron's office? A Tolkien Ring network.
What cows give each other when they meet? A milkshake.
"What did Captain Cook say to his men before they got on the ship? Let's get on the ship, men!"
What did Carlos the fireman name his twin newborn sons? Jose and Hose B.
What did King Kong say when he saw the Statue of Liberty? Are you my mother?
"What did one angel say to the other? ""Halo."""
What did one bolt of cloth say to the other bolt of cloth after	hurting its feelings? I'm sari.
What did one coffin say to the other? Is that you coughin'?
What did one mountain say to the other mountain after an earthquake? It's not my fault.
"what did one mountain say to the other?

meet you in the valley!"
What did one pig say to the other? Let's be pen pals!
What did one plate say to the other? Lunch is on me.
what did one snowman say to the other snowman? can you smell carrots?
"What did one strawberry say to the other strawberry? If you hadn't been so fresh, we wouldn't be in this jam!"
What did one tomato say to the other? Catch up.
What did one vampire say to the other vampire? Is that you coffin?
What did one wall say to the other? I'll meet you at the corner.
"What did Snow White say when she dropped off her film? ""Some day my prints will come."""
What did Sushi A say to Sushi B? Wasabi?
"What did Tarzan shout when he saw the elephants coming up over the hill? ""Here come the elephants up over the hill!"""
What did Tarzan shout when he saw the elephants coming up over thehill while wearing sunglasses? Nothing. He did not recognize them.
What did the alien say to the gardener? Take me to your weeder.
"What did the aliens say, when they came to earth in search of soda pop? Take me to your liter!"
"What did the angry inflatable teacher say to the irresponsible	inflatable child in the inflatable school? Not only have you let me down, you've let yourself down, and you've	let the whole school down!"
What did the apple say to the banana? Nothing -- apples don't talk!
What did the atlantic say to the pacific? Nothing. It just waved.
What did the big chimney say to the little chimney? I'm bigger than you!
What did the book say to the librarian? Can I take you out?
What did the boots say to the cowboy? You ride -- I'll go on foot.
"What did the bra say to the hat? ""I've got these two covered, you go on a head."""
What did the candle say when he was down on his luck? I'm at wick's end.
What did the carpenters call their brass quartet? The Tuba Four
What did the carpet say to the floor? Don't move -- I've got you covered.
"What did the cork say to the bottle? If you don't behave yourself, I'll plug you."
What did the cow say to the masked robber? Moo.
What did the dolphin say to the whale when he bumped into him? I didn't do it on porpoise.
What did the dolphin say to the whale when he bumped into him? I didn't do it on porpoise.
What did the duck say when she bought some lipstick? Put it on my bill.
"What did the farmer say when he lost his tractor? ""Where's my tractor?"
"What did the fish say when it hit the wall? ""Dam."""
What did the football say to the football player? I get a kick out of you.
What did the ghost say on December 25th? Scary Christmas!
What did the girl mushroom say about the boy mushroom? He's a real fun-guy.
What did the girl say when the Statue of Liberty sneezed? God bless America.
What did the girl sea say when the boy sea asked her for a date? Shore.
What did the grape say when the elephant stepped on him? Nothing. He just let out a little wine.
What did the head trauma patients do when the price of medicine went up? They went on stroke.
What did the kangaroo say when her baby was missing? Help! My pocket's been picked!
"What did the left eye say to the right eye? Just between you and me, something smells down there."
What did the leopard say when it ate the man? That hit the spot.
What did the lightbulb say to its mother? I wuv you watts and watts.
What did the lion say to the antelope? RAAAAAAAAAAAAAA
What did the man do after being found guilty of sabotaging the moon mission? He Apollo-gized.
What did the mermaid do last Saturday night? She went out with the tide.
What did the moron do when he thought he might be dying? He went into the living room!
What did the one nut say to the other? Would you like to go out on a date?
What did the parent say when the little girl was whining? Leave it to peave her.
What did the policeman say to his belly button? You're under a vest!
"What did the potato ask the cow? Give me some milk, and we can make mashed potatoes."
What did the ruler gain a reputation for while campaigning? Straight talk.
What did the sink say to the water faucet? You're a real drip.
What did the skunk use to contact his girlfriend? His smellular phone!
What did the sky say to the women? I can see down yo shirt!!
What did the snail say as he rode on the back of a turtle? Wheeee!
What did the snail say when he jumped on the turtle's back? Wheeeeee!
What did the spud lover do before it went to bed? It set its alarm for eight -- so it would get a potato clock.
What did the stamp say to the envelope? I'm stuck on you.
What did the strawberry say on December 25th? Berry Christmas!
What did the tie say to the neck? I think I'll just hang around.
What did the tire say to the tire? I'm tired!
What did the toilet say to the tub? Who see more butt. Me or you.
What did the writing utensil take for his high sugar level? Pencil-in.
What did the Zen master say to the hot dog vendor? Make me one with everything.
What did the zero say to the eight? Nice belt!
What do a telephone and a dog have in common? They both have collar ID.
What do a telephone and a dog have in common? They both have collar ID.
What do astronauts eat for dinner? Launch meat.
What do bees chew? Bumble gum.
What do flies wear on their feet? Shoos.
What do hard-working grocery store clerks get every year? A celery increase.
What do John the Baptist and Winnie the Pooh have in common? They have the same middle name!
What do kids like to eat in the playground? Recess Pieces.
What do modern artists eat for breakfast? Surreal.
What do outlaws eat with their milk? Crookies.
What do pelicans eat? Anything that fits the bill.
"what do penguins use as napkins?

flapkins!"
What do prisoners use to call each other? Cell phones.
"What do real men do to please their women?

Real men don't care."
What do snake charmers do in the rain? Turn on their windshield vipers.
What do space aliens put on their windows? Venutian blinds.
What do the bathroom doors at the funeral home say? His and Hearse.
What do turtles do for fun? Play hide and shell.
What do ya call a bunch of guys breaking into a music store and helping	themselves to the stringed instruments? Luters.
What do you call a 30 foot purple dinosaur named Fred who has acne	and is scared of penguins? Fred.
What do you call a blind dinosaur? An Idontthinkhesaurus.
What do you call a boomerang that doesn't come back? A stick.
"What do you call a chicken that crosses the road, rolls in the mud and crosses back over? A dirty double crosser."
What do you call a clairvoyant midget who escaped from prison? A small medium at large.
What do you call a clock on the moon? A lunartick.
What do you call a cow with a hysterectomy? Decalfinated.
What do you call a crab that plays baseball? A pinch hitter.
What do you call a cracked window? A pane in the glass.
What do you call a cute little animal you keep in your automobile? A carpet.
What do you call a deer with no eyes that isn't moving? Still no idea.
What do you call a deer with no eyes? No eye deer. What do you call a deer with no eyes and no legs? Still no eye deer.
What do you call a deer with no eyes? No idea.
What do you call a fish with no eye? Fsssssssh
