"An orchestra is playing Beethoven's 9th Symphony. There is a passage in themiddle when, for about 20 minutes, the bass violinists have nothing to do.So they decide to slip out to a bar and drink a few beers. After a while onesays, ""Hey, we better get going.""But another says, ""No, wait. I tied several pages of the conductor's sheet musictogether, so we'll have a couple of extra minutes while he sorts it out.""So they stay for another round. Finally when they go staggering back to theirplaces. It was the bottom of the ninth, the score was tied, and the bassistswere loaded."
Another poor soul worked at a company making blankets. He lost his jobwhen the company folded.
"As I rowed my little boatToward the river shore,A small black bird kept me from landing,Quoth the raven, ""never moor."""
"As I was looking at some apartments I saw a parking area with the sign,""Tenant Parking."" But what happens if there are more than ten ants?"
Ask me if I have a banana in my ear. Do you have a banana in your ear? I can't hear you. I have a banana in my ear.
Ask me if I'm a tree. Huh? Ask me if I'm a tree. Are you a tree? No.
"At a world brewing convention in the States, the CEOs of various Brewing organizations retired to the bar at the end of each day's conference.

Bruce, CEO of Fosters, shouted to the Barman: ""In 'Strylya, we make the best bladdy beer in the world, so pour me a Bladdy Fosters, mate.""

Bob, CEO of Budweiser, calls out next: ""In the States, we brew the finest beers in the world, and I make the King of them all gimme a Bud.""

Hans steps up next: ""In Germany ve invented das beer, verdamt. Give me ein Becks, ya ist Der real King of beers, danke.""

Paddy, CEO of Guinness, steps forward ""Barman, would ya give me a doyet coke wid ice and lemon. Tanks.""

The others stare at him in stunned silence, amazement written all over their faces. Eventually Bruce asks, ""Are you not going to have a Guinness, Pat?""

Paddy replies: ""Well, if you fookin' pansies aren't drinkin', then neither am I""."
"At school, I saw my principal walking around in a daze. I asked him whathappened, and he just looked at me and said, ""I've lost my faculties!"""
Atoms have mass? I didn't know they were Catholic.
"Before the days when dogs were used to sniff out drugs at airports, many different animals were tried, including chickens, due to their superior sense of smell. Things went awry, however, when the Sergeant in charge of the Poultry Unit was arrested for drug trafficking. At his arraignment, the press was scandalized when he pled guilty, but heremained indignant. ""What did you expect? I ran a fowl of the law!"""
"Bloke walks up and asks ""Do you prefer long legs or short?"", so I reply ""I prefer something in between"""
"Bum at the bus stop, lady walks up with dress up her crack, bum discretely pulls it out, lady slaps him, [hand gesture pushing it back into crack]"
"Can I ask you two questions? Ok, what's the second one?"
Chief Running Water had two sons. What were their names? Hot and Cold.
"Clown at birthday party, annoying kid wants to see magic trick, don?t do magic, annoying kid, drop yer pants turn around and bend over, feel my thumb in yer ass?, [hand gesture showing one thumb and then the other]"
"confluence 42 points 21 hours ago
A Polish farmer is ploughing his field when he hits an obstruction in the soil - a dirty old lamp. He picks it up and rubs it to clean it off, and a genie appears in a puff of smoke.
""Thank goodness you found my lamp I was getting bored,"" says the Genie. ""I will grant you any three wishes you desire.""
The farmer thinks and thinks and finally says: ""I want the Mongols to invade Poland... and then go home.""
The genie looks confused, but he shrugs, and snaps his fingers, and the Mongols invade. They rampage through the country, looting and pillaging... and then they go home.
""OK,"" says the genie, ""that was your first wish. What else do you want?""
""I want the Mongols to invade Poland again... and then go home.""
The genie sighs. ""Fine, it's your wish, I guess."" He snaps his fingers again, and the Mongols return. They set the farmhouse on fire, and steal the chickens, and then they go home.
""And what is your final wish?"" asks the genie.
""I want the Mongols to invade Poland again, and then go home,"" says the farmer without hesitation.
So the Mongols invade once again, and steal everything that isn't nailed down. They steal the farmer's old wife, and his plough, and rough him up a bit, and then they leave.
As they are both standing in the smoking, ransacked ruins of the farmhouse, the genie says: ""OK, I have to know. What the hell was that about? You could have wished for anything in the whole world, and you had the Mongols invade your own country three times, and totally destroy it. Why?!""
The farmer looks very pleased with himself. ""Well, you see, in order to invade us three times and go home, they had to go through Russia six times!"""
"Daniel and Ginny are walking down the street one evening. As they pass one house, they hear loud shouting and crashes inside. Peter and Elizabeth Jones live there and are having a fierce argument. At the height of the quarrel, Peter picks up a table lamp, rips it out of the wall, and hurls it at Elizabeth. Elizabeth ducks, and the lamp flies past her through the window. It sails over Daniel and Ginny's heads. Daniel looks up and exclaims, ""What light through yonder window breaks!"""
"Descartes walks into a bar and orders a drink. He sips it for a while, and when he is finished, the bartender asks him if he'd like another. Descartes says, ""I think not"", and disappears."
Did you hear about the agnostic insomniac dyslexic? He lay awake at night wondering if there's a Dog.
Did you hear about the Buddhist who refused Novocain during a root canal? He wanted to transcend dental medication.
"Did you hear about the circumcision doctor?

He slipped and got the sack."
Did you hear about the constipated mathematician? He worked it out with a pencil.
Did you hear about the fly that flew through a screen door? He strained himself.
"Did you hear about the fly who flew through a screen door at full speed?
Strained himself."
Did you hear about the guy that threw away a duck? He got down in the dumps.
"Did you hear about the human cannonball? First day on the job, he was fired."
Did you hear about the kidnapping down the street? His mother wouldn'twake him until 3.
"Did you hear about the man who fell into the upholstery machine? He's all right, now. In fact, he's fully recovered."
Did you hear about the marketplace where everything cost twelve and a half cents? It was a bit bazaar.
Did you hear about the peanut in the hospital? He was assaulted.
Did you hear about the pilot who went on sick leave? He had the flew.
Did you hear about the plumber who worked a top a skyscraper? He plunged to his death.
Did you hear about the professor that got in a horrible wreck? He was grading papers on a curve.
"Did you hear about the restaurant on the moon? It has great food, but no atmosphere."
Did you hear about the robbery at the flower shop? It was a violet crime.
"Did you hear about the two antennas that got married? The wedding was lousy, but the reception was great."
Did you hear that NASA recently put a bunch of Holsteins into low earth	orbit? They called it the herd shot 'round the world.
"Did you hear the headline abou the lunatic who raped the laundry woman and ran away? ""Nut screws washer and bolts"""
"Did you hear the headline about midget psychic on the run from the Law? It read, ""Small Medium At Large."""
Did you hear the watermelon joke? It's pitful.
Did you hear Willie Nelson got run over? He was playing on the road again.
Do you like warts? No. Don't worry. They'll grow on you.
"Do you want to hear the story about the broken pencil? No? Oh well. There'sno point to it, anyway."
Do zombies rule? Of corpse they do!
Doctor to a woman: The good news is you don't have PMS...the bad news is your a bitch
"Doctor: ""I've got bad news and good news. Which one do you want to hear first?"". Patient: ""The bad news"" Doctor: ""The bad news is that you've got cancer and only a few days to live"" Patient: ""Shoot!, what's the good news?"" Doctor (smiling): I'm doing your wife!"
"Doctor: ""I've got bad news for you. You are terminally ill.""

Patient: ""Is there anything I can do?""

Doctor: ""No, nothing.""

Patient: ""There has to be something...""

Doctor: ""No, nothing.""

Patient: ""Nothing at all?""

Doctor: ""Well, you can start taking mud baths.""

Patient: ""Does that help?""

Doctor: ""Not really, but your body will start to get used to being in the earth."""
"Doctor: ""I've got some bad news and some really bad news. The bad news is you only have a week to live.""

Patient: ""What could be worse news than that?""

Doctor: ""I've been trying to contact you for the last 6 days."""
"Doctor: I have bad news for you. You only have 10 left to live.

Patient: Ten what?

Doctor: Nine. Eight..."
"Doctor: I have two pieces of bad news for you. One is that you have cancer and is going to die soon. The other is that you have Alzheimers.

Patient: Oh. But at least I don't have cancer."
Does a roller coaster like its work? It has its ups and downs.
"Down in Virginia, the prosecutors brag they could get a grand jury to bring aham sandwich to trial. In fact, just last week, a banana was actuallyconvicted of murder. It was overturned on appeal."
Energizer Bunny arrested. Charged with battery.
"Every day, the good doctor stops by the local bar and orders a hazelnut daiquiri on his way home from the office. Before long, the bartender expects his visits and has the daiquiri waiting upon the doctor's arrival.

One day, the bartender begins to prepare the doctor's daily daiquiri but realizes he's all out of hazelnut. In a pinch, he opts to use hickory instead.

The doctor arrives, takes a sip of his drink, and says to the bartender, ""Hey, this isn't a hazelnut daiquiri."" The bartender nods and replies, ""You're right. It's a hickory daiquiri, Doc."""
"farmer wants to milk a cow in the barn. He puts his stool next to the cow and the bucket below it. As he starts milking the cow kicks the bucket with the left leg. After a while the farmer is pissed off and takes a rope to fix the cow's leg to a pole. Yet before he can start milking again the cow kicks the bucket with its right leg. So the farmer fixes the right leg to another pole. The farmer wants to start milking again, but now the cow is slapping him with its tail. Wanting to fix the tail to a roof beam he puts the stool behind the cow and steps on it. Having no rope left, he takes off his belt to fix the tail. So as he's holding the cows tail in one hand, his belt in the other his pants drop down right before his wife enters staring at him. He just says: ""You know, sometimes things are hard to explain"""
"General Sherman is marching through the South, and passes Stone Mountain in Georgia. On top is a lone rebel, hurling insults down on the Yankees.

Sherman sends ten men up to deal with the rebel. Twenty minutes pass, the men don't return, and the rebel appears again on top of the mountain, yelling insults.

Sherman sends a hundred men up to deal with the rebel. Twenty minutes pass, the men don't return, and the rebel appears again on top of the mountain, yelling insults.

Finally, Sherman sends a thousand men up to deal with the rebel. Twenty minutes pass, a one wounded man crawls back down. ""General,"" he gasps, ""it's a trap! There's two of 'em!"""
"God asks asks Adam how he's doing, - ""Well, it's ok but I am abit lonely"". - ""Ok"" God answers. - ""Let's do something about it. I can give you the most wonderful and satisfactory being and friend you'll ever need you'll never be lonely again, and you'll have everything you ever need"". - ""But it meens I need your arm and leg to create that beeing"". Adam ponders and isn't willing to sacrifice his arm and leg. -""Ok"" God says again. -""With only your leg, I can make a nice and welcoming partner for you, giving you no grief only happiness"" Adam ponders again - he is rather lonly but really wants his leg. ""What can I get for one of my rib bones ?"" Adam finally replies."
"Guy walks into a bar and catches the barman's eye.

""Double whisky!"" he shouts. The barman pours it, serves it and GULP, the guy knocks it back in one go.

""Are you alright, mate?"" asks the barman.

""Sure,"" says the guy, ""I'm celebrating - another double whisky!"" Barman serves it, guy grabs it and downs it in one again.

""What are you celebrating?"" asks the barman.

""Aaaaahhhh,"" says the guy ""can't tell you - it's a secret. Another double whisky!"". The barman serves it to him, the guy grabs it and downs it in one.

""Come on,"" says the barman, ""you'll be pissed in a minute and tell me anyway - what're you celebrating?""

""Oh all right,"" says the guy, looking around furtively, ""first blowjob!""

""Ohhhhhh, well done my son!"" beams the barman, ""here, have one on me!""

The guy peers at the drink, thinks, sniffs. ""No thanks"", he says, ""if three won't get rid of the taste, nothing"
"Guy walks into a petshop and sees three parrots, priced $500.-, $1,500.-, $2,500.- and $30,000.-, so he asks the owner, ""Hey why are those parrots so expensive ?""

""Well,"" says the owner, ""that first one can speak english, german and mandarin perfectly and translates any sentence you desire, from one language into another.""

""What about the second one ?""

""Well, that parrot not only knows four languages, but can also type business letters using a computer""

""And the third one ?""

""Oh, that one can speak seven languages, use the computer, e-mail, internet and does online research for you.""

""Amazing ! And what about the last one ?"", says the guy.

""Oh ! ... that one doesn't do anything at all. Just sits there all day long.""

""Then why is it so expensive ?!?!?!""

The owner takes the guy to the side and whispers, ""Well, I haven't seen it do anything, but the other three parrots call it BOSS""."
"Have you ever seen an elephant in a strawberry patch? Works pretty well, doesn't it?"
Have you heard about the new corduroy pillows? They're making headlines!
Have you heard the joke about the bed? No. It hasn't been made up yet!
Have you heard the joke about the flying sandwich? Nope. Neither have I.
"Have you heard the one about the Agnostic, Dyslexic, Insomniac? 
 
He lays awake every night wondering if there really is a dog."
"Have you heard the one about the witch's broom? It's sweeping the valley.(That one usually floors me, but I'm going to brush it aside before I'm swept away with laughter.)"
"Have you seen the new Barbie Doctor doll? You wind her up, and she operates on batteries."
"Heard about the new low fat comminion wafer? it's called ""I can't believe it's not Jesus"""
"Henry Lang grew up in Kansas, part of the most wealthy and influentialfamily in the area. Everyone around knew of the Langs, and eventually, ingratitude for all that the family had done for the area, the townsfolkerected a huge sign in front of the train station, saying, ""Welcome on behalfof the Langs."" One day, Henry, now in his forties, returned to the area, andhe was shocked to see that the townsfolk had taken down the old Lang sign."
"Holmes and Watson have come out of a country pub at the end of a long night of quaffing warm ale. As they wander down the road, they can just make out a tree in the darkness and head over to answer the call of nature. As they are mid-flow, Holmes asks Watson what he can deduce from the sound of his stream. Watson replies that he believes the tree to be an oak of between 100-150 years with some disease in the past causing a hollow in the centre. As he expounds further, Holmes cuts him off and snaps, 'From the sound you are making I deduce that you are pissing on my shoes'."
"Holy Kleenex, Batman! He was right under our nose, and we blew it!"
"How are an elephant and a plum the same? They're both purple, except for the elephant."
How can you get out of a locked room with a piano in it? Play the piano until you find the right key.
How can you make a slow horse fast? Don't give him any food.
How can you tell 2 twin witches apart? You cant tell which bitch is which
How can you tell when there's an elephant in your sandwich? When it's too heavy to lift.
"How can you use a lighthouse, rose trellis, windstorm, dune, andHalloween costume to create something tasty? Make a beacon, lattice, and tornado sand witch."
How did the alien tie his shoes? With an astroknot.
How did the chewing gum cross the road? By sticking to the chicken's foot.
How did the pig get to the hospital? In a hambulance.
How do dogs order eggs at restaurants? Pooched.
How do elephants smell? Really bad.
How do librarians file melted marshmallows? According to the Gooey Decimal System.
How do small people call each other? On microphones.
How do you catch a green elephant? Paint him red and catch him with the red elephant trap.
"How do you catch a polar bear? First dig an ice hole. Then put a whole bunch of little green peas on the outside, and when the polar bear comes to take a pee you kick him in the ice hole."
How do you catch a rabbit? Hide in a meadow and make carrot noises.
How do you catch a red elephant? With a red elephant trap.
How do you catch a tame rabbit? The tame way -- unique up on him.
How do you catch a unique rabbit? Unique up on him.
How do you catch an elephant? You dig a hole fill it with ashes and when the elephant walks by kick him in the ash hole!
How do you catch an orange elephant? I don't know. I've never seen an orange elephant.
"How do you fit an elephant in a safeway bag? Take the S out of safe, and the F out of way.... Oh wait, there's no f'in way!"
How do you fix a broken chimp? With a monkeywrench.
How do you fix a broken pizza? Use tomato paste.
How do you get 27 kids to carve a statue? Have everybody chip in.
"How do you get three old ladies to say fuck? Have a fourth one say ""Bingo!"""
How do you know when the moon is going broke? When it's down to its last quarter.
How do you know when there's a elephant under your bed? Your nose is pressed against the ceiling.
How do you make a hot dog stand? Take away its chair.
How do you make a Venetian blind? Stick a finger in his eye.
How do you make an idiot think he's a duck? Tell him he's a duck.
How do you make anti-freeze? Take away her blanket.
How do you make any watch a stopwatch? Don't wind it.
How do you make soup gold? You put in fourteen carrots.
How do you mend a jack-o-lantern? With a pumpkin patch.
How do you put an elephant in a refrigerator? Step one: Open the door.	Step two: Put the elephant in.	Step three: Close the door.
"How do you turn a dishwasher into a snowblower?

Hand the bitch a shovel."
How does a coffee pot feel when it is hot? Perky.
How does a cow add and subtract? With a cowculator.
How does a man on a moon get his haircut? Eclipse it.
How does a pair of pants feel when it is ironed? Depressed.
How does a witch tell time? With a witchwatch.
How does an elephant climb a tree? He hides in an acorn and waits for a bird to carry him up.
How does an octopus go to war? Armed.
How does Hitler tie his shoes?? He makes little NAZIS
"How is a banana peel on the sidewalk like music? If you don't C sharp, you'll B flat."
How is a thief like a thermometer on a hot day? They are both up to something.
"How many blondes does it take to change a lightbulb?
1. One to hold the bulb and 2 to turn the ladder."
"How many Dragon Ball Z characters does it take to screw in a lightbulb? Only one, but it takes three episodes."
"How many feminists does it take to change a lightbulb?

THATS NOT FUNNY (must yell it)"
"How many feminists does it take to change a lightbulb?
Trick question, feminists can't change anything."
"How many Harvard graduates does it take to change a light bulb? 

One. He just puts it in the socket and lets the world turn around him."
"How many KGB agents does it take to change a lightbulb?

Three. Two to hold it down, and one to apply the electrodes."
"How many mystery writers does it take to change a light bulb?

Two - One to put it most of the way in, and one to give it an interesting twist at the end."
"How many people does it take to screw in a lightbulb?

2, but they have to be very tiny"
"How many psychiatrists does it take to change a lightbulb?

One but the lightbulb has to want to change."
"How many WASPs does it take to change a lightbulb?

One."
"How manyh grad students does it take to change a light bulb?

One, but it takes 7 years."
"How much did the pirate pay to have his ears pierced? 
a buck an ear"
How much does it cost for a pirate to get his ears pierced? A buck an ear.
"I bet the butcher he couldn't reach the beef on the top shelf, but he saidthe steaks were too high."
"I came home the other day to find my girlfriend dipping twenty dollar billsin batter and frying them. I said, ""There you go again, frittering ourmoney away!"""
I know one person who thinks he's an owl. Who? Now I know two.
"I rang up a pizza shop and asked ""do you deliver?"" they repiled ""no we do pizza""."
"I stole a futon from a shop. I think the police are after me, so I have beenlying low."
"I took the day off work and decided to go out golfing. I was on the second hole when I noticed a frog sitting next to the green. I thought nothing of it and was about to swing when I heard, ""ribbit ... 9 iron.""

I looked around and didn't see anyone. Again, I heard, ""ribbit 9 iron."" I looked at the frog and decided to prove the frog wrong, put the club away, and grabbed a 9 iron.

Boom! I hit it 10 inches from the cup. I was shocked. I said to the frog, ""Wow that's amazing. You must be a lucky frog, eh? The frog replies, ""ribbit lucky frog."" so I decided to take the frog with him me the next hole. ""What do you think frog?"" I asked. ""ribbit 3 wood.""

I took out a 3 wood and, Boom! Hole in one. I was befuddled and didn't know what to say. by the end of the day, i golfed the best game of golf in my life and asked the frog, ""ok where to next?""

The frog replies, ""ribbit las vegas"".

We went to las vegas and said, ""Ok frog, now what?"" The frog says, ""ribbit roulette."" Upon approaching the roulette table, I asked, ""what do you think I should bet?"" The frog replies, ""ribbit $3000, black 6.""

Now, this is a million-to-one shot to win, but after the golf game I figured what the heck.

Boom! tons of cash comes sliding back across the table.

I took my winnings and bought the best room in the hotel. I sat the frog down and said, ""frog, I don't know how to repay you. you've won me all this money and I am forever grateful.""

The frog replies, ""ribbit kiss me."" I figured why not, since after all the frog did for me, he deserves it. with a kiss, the frog turns into a gorgeous and well-developped 15-year-old girl.

""And that, your honor, is how the girl ended up in my room. So help me God"""
I used to own a car that never seemed to run properly. It was a brokeswagen.
"If an elephant and a giraffe had a race, who would win? The elephant. The giraffe is in the refrigerator."
"If I hit a baseball and it rolled under the fence and was eaten by a pig, what would the ruling be? an inside the pork homerun"
"If I were to ask you to dance naked for me, would your answer be the same as to this question?"
"If one horse is in the corral, running around the perimeter of the fence,and another horse is running free in a field, which one is singing, ""Don't Fence Me In""? Neither. Horses can't sing."
"If one synchronized swimmer drowns, do they all have to drown?"
"If two people had a race and one had sand in his shoe but the other did	not, who would win? The one with sand in his shoe -- if it was quicksand."
"If vampires have no reflection, how come they have such neat hair?"
"If you steal a clean slate, does it go on your record?"
"In a particular small country, there was a king. He was much beloved ofthe people, and so they built for him a castle. But they were poor peopleand could only afford to build it out of grass. So they worked for weeks,and finally completed a lovely woven grass castle for him. And the king waspleased.Another country, significantly richer than the first, presented a peaceoffering of an ornate throne. The king accepted this gift graciously andwas most pleased. The only trouble was, the throne was very uncomfortable.So the king got himself a more comfortable chair and kept the massivethrone in the attic. Naturally, it fell through the floor and killed him.The moral of this story: People who live in grass houses shouldn't stowthrones."
"In the middle of the forest, a turtle and a snail have a gruesome head-on collision. The snail is rushed to the emergency room, where a doctor asks what happened. On the edge of consciousness, the snail responds, 'I don't know, Doc. It all happened so fast.'"
"In Washington D.C., helicopters are often used to monitor the trafficconditions. Frequently jammed is the Francis Scott Key bridge, named afterthe man who wrote the national anthem. The bridge's traffic problem isnotorious; among some, it's known as the Car Strangled Spanner."
Is it dangerous to swim on a full stomach? Yes. It's better to swim in water.
