"""A couple of New Jersey hunters are out in the woods when one of them falls to the ground. He doesn't seem to be breathing, his eyes are rolled back in his head.

""The other guy whips out his cell phone and calls the emergency services. He gasps to the operator: 'My friend is dead! What can I do?'

""The operator, in a calm soothing voice says: 'Just take it easy. I can help. First, let's make sure he's dead.'

""There is a silence, then a shot is heard. The guy's voice comes back on the line. He says: 'OK, now what?'"""
"""Doctor, doctor, there's a lettuce sticking out of my arse! Is it serious?""

""I'm sorry to tell you, that's just the tip of the iceberg."""
"""Have you heard about the new pirate movie?"" ""It's rated aaarrrrrrrr."""
"""Mommy, mommy, I don't wanna see grandma!""

""Shut up and keep digging!"""
"""Why don't Mr. and Mrs. Smokey the Bear have any children?""

""I give up, why?""

""Because every time Mrs. Bear gets hot Mr. Bear throws dirt on her and beats her with a shovel."""
"A bear walks in to a bar and says to the bartender, ""give me a drink."" The bartender says, ""sorry, we don't serve bears."" The bear says, ""well, give me a drink or I'll eat that woman at the other end of the bar."" The bartender says, ""psh, go ahead."" So the bear eats the woman and asks the bartender one more time to give him a drink. The bartender says, ""we don't serve bears on drugs."" The bear, clearly dumbfounded says, ""what? I'm not on drugs."" And the bartender says, ""that was a bar-bitch-you-ate"""
"A bee is flying around looking for some nectar to make his honey and cannot find any. so this other bee buzzes up and says ""hey there's a bar mitzvah in that banquet hall over there and there's TONS of flowers in there you can get your nectar from!"" so the bee buzzes over the bar mitzvah in search of these flowers. an hour later he comes back wearing a yarmulke. the other bee buzzes up and says ""hey! why are you wearing that?"" to which the bee replies, ""i didn't want them thinking i was a WASP."""
a big fat women looked in the mirror and said to her husband 'im fat and ugly say something to make me feel better' he said 'your eyesight is perfect
"A big scary looking man comes to a trader in a slave market. ""Can you sell me ten slaves for some, uh, fun"". ""Of course"" says the trader. The man picks 10 fittest male slaves, orders them to stay in line and then takes a gun and shoots nine of them at random. The surprised trader asks: ""Why the hell didn't you buy just one instead of wasting 9 perfectly good slaves"". The man answers: ""That's just not the same... Look at that last guy - he has such a tight ass now!"""
"A blonde speeder is pulled over by a blonde police officer.

The blonde cop says ""I need to see your license"". The blonde driver digs through her purse for awhile, and says ""I can't find it. What does it look like?"".

So the cop, making a rectangle with her hands, says ""it's rectangular, and has your picture on it"". The blonde driver searches through her purse but can't find it. She finally comes up with the only rectangular item, a small mirror.

She looks at it, shrugs, and hands it to the blonde cop. The blonde cop looks at it, shrugs, and hands it back to the blonde driver. ""Oh, you can go"" the blonde cop says.

""I didn't realize you were a cop""."
"A Bostoner is visiting Austin, admiring a large bronze statue. One of the locals approaches and says, ""This here's a Texas Ranger.""

The Bostoner says, ""We have a statue like this in my hometown, a statue of Paul Revere.""

The Texan thinks about this for a long moment. ""Is that that guy who had'ta git help?"""
A boy asked his rich uncle for a cowboy outfit for his birthday.So the uncle bought him a used car dealership.
"A boy came into the house with a sofa on his back. His father said, ""How many times have I told you not to accept suites from strangers!?"""
"A byte walks into a bar and orders a pint. Bartender asks him ""What's wrong?"" Byte says ""Parity error."" Bartender nods and says ""Yeah, I thought you looked a bit off."""
"A byte walks into a bar and orders a scotch on the rocks.

The bartender asks, ""Rough day?"".

""parity error"" replies the byte.

""Yeah, you looked a bit off..."""
"A cabbage, a faucet, and a tomato had a race. The cabbage was ahead, thefaucet was running, and the tomato tried to catch up."
"A carrot and a tomato were walking across the street when the carrot was hit by a car. The tomato called 911. An ambulance came and took the carrot to the hospital. The tomato went to the hospital to wait for his friend, and when he got there the carrot was still in the emergency room, so the tomato paced nervously. Finally, the doctor called out, ""Mr. Tomato?"" The tomato went over, and asked the doctor, ""How is he?"" The doctor replied, ""I have good news and bad news. The good news is that he is still alive. The bad news is that he will be a vegetable for the rest of his life."""
"A certain leisure complex had a cinema and a swimming pool. One day, thecinema screen fell into the pool. The owners left it there and used it as adive-in theater."
"A club sandwich walks into a bar. The bartender says, ""I'm sorry, we don'tserve food here."""
"A convent was going to receive a visit by the Pope, so the mother superior wanted to get the place spruced up. She assigned two nuns to repaint the guest bedroom.

""Do a good job,"" she ordered, ""and don't get any paint on your habits.""

The nuns decided that the best way to not get paint on their clothes was to work in the nude. They had been painting for a couple of hours when there was a knock at the door.

""Who is it?"" they asked.

""It's the blind man.""

They figured that a blind man wouldn't be able to tell that they were naked, so they told him to come on in.

The door opened. ""Hey, nice tits! Where do you want these blinds?"""
"A deer, a skunk, and a duck went to the grocery store. When they were readyto check out, the deer didn't have a buck, the skunk didn't have a scent,so they put it all on the duck's bill."
"A dentist found something wrong with one of his patients. The upper plate thathad been put in earlier was corroding. ""What have you been eating?"" thedentists asked the man.""All I can think of is that about three months ago mywife made some asparagus and put Hollandaise sauce on it. I loved it so much,I put it on everything now.""""That's the problem,"" the dentist said, frowning. ""Hollandaise sauce containslemon juice, which is highly corrosive. I'll make you a new plate, and thistime use chrome.""""Why chrome?""""It's simple. Everyone knows there's no plate like chrome for theHollandaise."""
"A director decides that he's going to make a movie based on the livesof famous classical composers. Looking for a prospective cast, he asksSylvester Stallone which composer he would like to play in the movie. Stallonethinks for a moment and says, ""I like Mozart. Let me be Mozart.""The director then turns to Arnold Schwarzenegger and asks him who he'dlike to play. Arnold replies, ""I'll be Bach!"""
"A doctor made it his regular habit to stop off at a bar for a hazelnutdaiquiri on his way home. The bartender knew the doctor's habit and wouldalways have a drink waiting. But one day the bartender ran out of hazelnutextract, so he substituted hickory nuts. When the doctor arrived, he took asip and exclaimed, ""This isn't a hazelnut daiquiri!""""No, I'm sorry,"" the bartender replied. ""It's a hickory daiquiri, doc."""
"A duck walks into a 7-11 and says ""Give me some chapstick, put it on my bill!"" But the cash register attendee doesn't speak English and cannot understand him. He does, however, question whether his God is punishing him because as all people know, Ducks cannot speak, however, this hallucination must be punishment for a horrid misdeed. THe employee breaks down into tears and begins reciting prayer. The duck, slightly miffed, walks out, pondering why he'd need chapstick anyway, since he has no lips."
"A duck walks into a bar. He hops up on a stool and asks a bartender ""got any grapes?"". The bartender replies ""no, this is a bar. We don't have grapes here"". The duck leaves. The next day he comes in to the same bar, hops up on the same stool and says ""got any grapes?"" the bartender angrily replies ""NO! we don't have any grapes. I told you yesterday that this is a bar, now if you ask me one more time I'm gonna nail your feet to the floor"". The duck leaves. The next day the duck returns and hops up on the same stool. The duck asks ""got any nails?"" The bartender, puzzled says ""no, why?"" the duck replies ""got any grapes?"""
"A general noticed one of his privates was behaving oddly. He'd pick up a piece of paper and say, ""No, no, that's not it!"" After some weeks he was seen by the psychiatrist. The psychiatrist concluded the private was deranged and wrote his discharge from the army. The private picked it up and said, ""Yes, that's it!"""
"A group of chess enthusiasts had checked into a hotel and were standing inthe lobby discussing their recent tournament victories. Soon the manager cameout and asked them to disperse. ""But why,"" one asked.""Because,"" he said, ""I can't stand chess nuts boasting in an open foyer."""
"A group of friars lived in a monastery. As with many monasteries, the friarsfound it necessary to run a small business to support themselves. They ran afloral shop. One day one of the friars brought in an exquisite find: a Venusfly trap. It was such a cute thing, they couldn't bear to sell it, so theyjust kept it on display. But after a while, it grew so big that flies were nolonger enough to satisfy it. It ate cockroaches, but it kept growing. Itate mice, but it still kept growing. It ate chipmunks, squirrels, cats, thenraccoons and dogs and ponies. Finally the villagers got wise to this andattempted to put a stop to it. But try as they might, no one could. One wayor another, the friars outsmarted the townsfolk and raided their farms oflarge animals. Finally the villagers pooled their money and hired aprofessional named Hugh to come in and capture the friars. Hugh stormed themonastery, destroyed the fly trap, captured the friars, and turned them overto the police. The moral of this story is: Only Hugh can prevent floristfriars."
"A group of Yale students are travelling around the South on their Spring Break. They pass an old man, sitting on a porch. ""Where you boys from?"" asks the man. ""Yale,"" they reply. The old man stands up and asks ""WHERE YOU BOYS FROM!"""
"A guy goes to the Olympics and sees a man carrying a long pole.

The guy asks - Are you a pole vaulter?

The man replies - No I'm German - how did you know my name is Walter?"
"A guy spent five years traveling all around the world making adocumentary on Native dances. At the end of this time, he had every singlenative dance of every indigenous culture in the world on film -- or so hethought. He wound up in Australia, in Alice Springs, so he popped into apub for a well earned beer.He got talking to one of the local Aborigines and told him about hisproject. The Aborigine asked the guy what he thought of the Butcher Dance.""Butcher Dance?"" he said, confused. ""What's that?""""What? You didn't see the Butcher Dance?""""No, I've never heard of it.""""Mate, you're crazy,"" the Aborigine replied. ""How can you say you filmedevery native dance if you haven't seen the Butcher Dance?""""Umm. I got a Corroborree on film just the other week. Is that what youmean?""""No, no. The Butcher Dance is much more important than the Corroborree.""""Oh,"" the man said, his curiosity piqued. ""Well how can I see this ButcherDance then?""""Mate, the Butcher Dance is way out in the wilderness. It'll take you manydays of travel to go see it.""""Look, I've been everywhere from the forests of the Amazon, to deepestdarkest Africa, to the frozen wastes of the Arctic filming these dances.Nothing will prevent me from recording this one last dance.""""Ok, mate,"" the Aborigine replied, shrugging. ""You drive north along thehighway towards Darwin. After you drive 197 miles, you'll see a dirt trackveer off to left. Follow the dirt track for 126 miles till you see big hugedead gum tree -- the biggest tree you've ever seen. Here you gotta leave car,because it's much too rough for driving. You strike out due westinto the setting sun. Walk three days till you hit a creek. You follow thiscreek to the northwest. After two days you'll find where the creek flows out ofsome rocky mountains, but it's much too difficult to cross the mountains there,though. So you head south for half day until you see a pass through mountains.The pass is very difficult and very dangerous. It'll take you two, maybethree days to get through it. On the other side, head northwest for fourdays until you reach a big huge rock -- twenty feet high and shaped like a man'shead. From the rock, walk due west for two days, and then you'll find thevillage. You'll be able to see the Butcher Dance there.""So the guy grabbed his camera crew and equipment and headed out. After acouple of hours, he found the dirt track. The track was in a shocking state,and he was forced to crawl along at a snail's pace, and so he didn't reach thetree until dusk, where he was forced to set up camp for the night.He set out bright and early the following morning. His spirits were high,and he was excited about the prospect of capturing on film this mysteriousdance that he had never heard mention of before. True to the directions hehad been given, he reached the creek after three days and followed it foranother two, until he reached the rocky mountains.The merciless sun was starting to take its toll, and the spirits of bothhimself and his crew were starting to flag; but wearily they trudged on,finally finding the pass through the mountains. Nothing would prevent him fromcompleting his life's dream. The mountains proved to be every bit astreacherous as their guide had said, and at times they despaired of evergetting their bulky equipment through. But after three and a half days ofback breaking effort, they finally forced their way clear and continued theirlong trek.When they reached the huge rock, four days later, their water was running low,and their feet were covered with blisters, but they steeled themselves andheaded out on the last leg of their journey. Two days later they virtuallystaggered into the village. To their relief, the natives welcomed them andfed them and gave them fresh water, and they began to feel like new men. Oncehe recovered enough, the guy went before the village chief and told him thathe came to film their Butcher Dance.""Oh mate,"" he said. ""Very bad you come today. Butcher Dance last night. Youtoo late. You miss dance.""""Well, when do you hold the next dance?""""Not till next year.""""Well, I've come all this way. Couldn't you just hold an extra dancefor me tonight?""""No, no, no!"" the chief exclaimed. ""Butcher Dance very holy. Only hold once ayear. You want see Butcher Dance, you come back next year.""Understandably, the guy was devastated, but he had no other option but tohead back to civilization and back home.The following year, he headed back to Australia and, determined not to missout again, set out a week earlier than before. He was quite willing tospend a week in the village before the dance is performed in order to ensurehe was present to witness it.But right from the start, things went wrong. Heavy rains that yearturned the dirt track to mud, and the car got bogged down every few miles.Finally they had to abandon their vehicles and slog through the mud onfoot almost half the distance to the tree. They reached the creek and themountains without any further problems, but halfway through the mountain pass,they were struck by a fierce storm that raged for several days, during whichthey were forced to cling forlornly to the mountainside until itsubsided.Then, before they had traveled a mile out from the mountains, one of thecrew sprained his ankle badly, slowing down the rest of their journeygreatly. Eventually, having lost all sense of how long they had been traveling,they staggered into the village right at noon.""The Butcher Dance!"" the man gasped. ""Please don't tell me I'm too late tosee it!""The chief recognized him and said, ""No, white fella. Butcher Dance performedtonight. You come just in time.""Relieved beyond measure, the crew spent the rest of the afternoon settingup their equipment and preparing to capture the night's ritual on celluloid. Asdusk fell, the natives started to cover their bodies in white paint and adornthemselves in all manner of birds' feathers and animal skins. Once darknesshad settled fully over the land, the natives formed a circle around a hugeroaring fire. A deathly hush descended over performers and spectators alikeas a wizened old figure with elaborate swirling designs covering his entirebody entered the circle and began to chant.""What's he doing?"" the man whispered to the chief.""Hush,"" the chief whispered back. ""You first white man ever to see mostsacred of our rituals. Must remain silent. Holy man, he asks that the spiritsof the dream world watch as we demonstrate our devotion to them through ourdance, and, if they like our dancing, will they be so gracious as to watchover us and protect us for another year.""The chanting of the holy man reached a stunning crescendo before he removedhimself from the circle. The rhythmic pounding of drums boomedout across the land, and the natives began to sway to the stirring rhythm.The guy became caught up in the fervor of the moment himself. This wasit. He realized beyond all doubt that his wait had not been in vain. Hewas about to witness the ultimate performance of rhythm and movement everconceived by mankind.The chief strode to his position in the circle and, in a big boomingvoice, started to sing: ""You butch yer right arm in. You butch yer right armout. You butch yer right arm in, and you shake it all about...."""
"A guy walked into a bar with his giraffe. He ordered a drink, and the giraffe laid down beside him. The bartender barked angrily, ""Excuse me, but you can'tleave that lying there!""""Err,"" the man said, ""It's not a lion. It's a giraffe."""
"A guy walks into a bar with his pet monkey. He orders a drink and while he's drinking it the monkey is running wild. The monkey jumps up on the pool table and grabs the cue ball, sticks it in his mouth and swallows it whole.

The bartender is livid and says to the guy, ""Did you see what your monkey just did?""

""No. What did that stupid monkey do this time?"" says the patron.

""Well, he just swallowed the cue ball off the pool table, whole"" says the bartender.

""Yeah, well I hope it kills him because he's been driving me nuts"" says the patron.

The guy finishes his drink and leaves.

Two weeks later he comes back with the monkey. He orders a drink and the monkey starts running wild around the bar again. While the man is drinking his drink, the monkey finds some peanuts on the bar. He grabs one, sticks it up his butt, then pulls it out and eats it. The bartender is disgusted.

""Did you see what your monkey did now?"" he asks.

""What now?"" responds the patron. ""Well, he stuck a peanut up his butt, then pulled it out and ate it"" says the bartender.

""Well, what do you expect?"" replied the patron. ""Ever since he ate that darn cue ball he measures everything first!"""
A guy walks into a doctors office with a carrot in his ear and a piece ofcelery up his nose. The doctor told him he wasn't eating right.
"A guy was walking down the street when he noticed a little boy walking aroundwith a piece of steak on his head. So he asked, ""Little boy, why do you have apiece of steak on your head?""""I'm not a boy,"" the boy answered. ""I'm a fork."""
"A guy went to a psychiatrist. ""Doc,"" he said, ""I keep having these alternatingrecurring dreams. First I'm a teepee, then I'm a wigwam, then I'm a teepee,and then I'm a wigwam. It's driving me crazy. What's wrong with me?""The doctor replied, ""It's very simple. You're two tents."""
"A hamburger walks into a bar, and the bartender says, ""I'm sorry, but we don'tserve food here."""
"A Harvard man and a Yale man go into a washroom and use the urinals. After they are done, the Harvard man stopped to wash his hands, while the Yale man headed for the door.

The Harvard man looked at the Yale man disapprovingly. ""At Harvard, we take care to wash our hands after using the lavatory.""

""Well,"" the Yale man replied, ""at Yale, we know not to piss on our hands."""
"A horse walks into a bar. The bartender says, ""Why the long face?"""
A hungry African lion came across two men. One was sitting under a tree andreading a book; the other was typing away on his typewriter. The lion pouncedon the man reading the book and devoured him. Even the king of the jungleknows that readers digest and writers cramp.
"A Jew, a Catholic and a Mormon are sitting around talking about their families.

The Jewish guy says, ""I have four sons. One more boy and I can have a basketball team.""

The Catholic says, ""Well, I have eight sons one more, and I'll have me a baseball team.""

Not to be outdone, the Morman says, ""I've got 17 wives. One more hole and I'll have myself a golf course."""
"A Jewish missionary went to Africa to educate a tribe of pygmies calledTrids. After a few weeks, during the first full moon, the Rabbi noticed theTrids getting nervous. Then all of a sudden, a giant gorilla came out ofthe jungle and started kicking the Trids up in the trees. The Rabbiconfronted the gorilla and said, ""Pick on someone your own size!"" The gorillareplied, ""Silly Rabbi, kicks are for Trids!"""
"A man and his wife are playing golf. He shanks one into the rough, and finds an old barn between him and the hole. ""No problem,"" says his wife, ""I'll open the barn doors and you can hit it through the barn."" She does this, but the ball bounces off a beam, hits her in the head and kills her.

Three years later, the widower and his buddy are playing the same course, and the widower lands again in the same spot. ""No problem,"" says his buddy, ""I'll open the barn doors and you can hit it through the barn.""

""Hell, no!"" says the widower. ""Last time I tried that, I came in five over par!"""
"A man had a son, but he was born as only a head. The man lovedhis son very much and took care of him, even though he was only a head.When the son turned 21, the man took him to a bar.""One whiskey for my boy, barkeep!"" said the man.""You don't want to do that,"" said the bartender.""He's a man, just turned 21! Get him a whiskey!""""I'm serious,"" the bartender insisted. ""It's a bad idea.""""Just do it!"" ordered the man.So the bartender got the head a whiskey, and when he drank it, hesprouted a body! The head and his dad were excited, but the bartenderwasn't pleased.""Wow, another one of those for my boy!"" yelled the man.""It's a really bad idea,"" the bartender stated.""Just give him a stupid whiskey! Geez, I'm payin', ain't I?"" said theman, a little frustrated now.So the bartender gave the son a whiskey, and he grew an arm! The father madethe bartender give more whiskey to the head, and he grew another arm, a leg,another leg, and finally the head was a whole person.The son was so excited that he ran into the street, screaming andshouting happily, and was hit by a car and died.""I told you,"" the bartender said. ""You should've quit while he was a head."""
"A man is a bus driver on Sesame Street and insists on meeting all of hisriders. At the first stop, two overweight women got on the bus; both are namedPatty. At the next stop, a mentally challenged boy named Ross got on.At the final stop, a disgusting man named Lester Freeze got on, took offhis shoes, and picked at his bunions.When the bus driver got home, his wife asked him if he met anyone new thatday. He said, ""Two obese Patties, special Ross; Lester Freeze picks hisbunions on a Sesame Street bus."""
